{
  "case_id": "NR-01",
  "focal_question": "Is one woman's failed funding round explained by gender discrimination?",
  "required_properties": ["P01", "P02", "P10"],
  "optional_properties": ["P05", "P07"],
  "must_not_fail": ["P02"],
  "not_applicable": ["P09", "P12"],
  "forbidden_shortcuts": ["E01", "E13", "E14"],
  "acceptable_conclusions": [
    "case-level evidence insufficient to attribute to gender",
    "aggregate VC gender gap real but does not establish this instance"
  ],
  "unacceptable_conclusions": [
    "clearly gender discrimination (forced structural)",
    "purely a competence problem, gender irrelevant (forced other way)"
  ],
  "epistemic_confidence_range": "indeterminate to weak; not a strong causal claim in either direction",
  "allowed_alternative_interpretations": [
    "may weight the aggregate pattern more or less, as long as instance != pattern is kept"
  ],
  "expected_modules": {
    "necessary": ["evidence", "null-result"],
    "optional": ["power-structure"],
    "inactive": ["baseline-interrogation", "comparison"]
  },
  "expected_depth_behavior": "concise: one-line null result kept; deep: expand aggregate evidence WITHOUT flipping to a strong instance claim",
  "expected_responsibility_behavior": "N-A",
  "expected_structural_claim_strength": "aggregate supported; instance unsupported"
}
